{
  "origin": "real_saved",
  "kind": "result_observation",
  "source": "https://api.football-data.org/v4/matches/560571",
  "acquired_at": "2026-10-11T20:24:38.936516+00:00",
  "record": {
    "football_data_match_id": 560571,
    "status": "FINISHED",
    "home_team_id": 67,
    "away_team_id": 1044,
    "score_90_minutes": {
      "home": 2,
      "away": 2
    },
    "observed_at": "2026-10-11T20:24:38.936516+00:00"
  }
}
